{
  "schema_version": "1.0.0",
  "catalog": "jobs_events",
  "snapshot": {
    "as_of": "2026-08-01",
    "baseline": "Proposed durable work and outbox contract",
    "approval": "PENDING_OWNER"
  },
  "records": [
    {"id":"job.plan_generation","name":"Plan generation","lifecycle":"TARGET_PLANNED","owner":"Plans, actions and Daily Review","kind":"job","states":["queued","running","retry_wait","ready","failed","cancelled","dead_letter"],"authoritative_store":"ops.generation_jobs","deduplication":"actor plus Idempotency-Key and request hash","lease":"Required with heartbeat and attempt limit","terminal_result":"READY plan id/revision or stable failure code","evidence":["ADR-007","ADR-008"],"notes":"The latest owner-scoped job for an authoritative profile-local day, including terminal jobs, is readable for cold-start recovery. Only an explicit POST creates a job."},
    {"id":"job.plan_variant_replacement","name":"Selected plan-variant replacement command","lifecycle":"TARGET_IMPLEMENTED_UNVERIFIED","owner":"Plans, actions and Daily Review","kind":"job","states":["ready"],"authoritative_store":"ops.generation_jobs","deduplication":"Plan mutation Idempotency-Key and request hash","lease":"Not applicable: deterministic local selection commits synchronously","terminal_result":"Successor READY plan id/revision","evidence":["ADR-004","ADR-007","20260808_0011","tests/test_v2_postgres_invariants.py"],"notes":"This is not AI generation and has no worker/provider call. Provider-backed replacement is a separate pending workflow."},
    {"id":"job.conversation_response","name":"Conversation response generation","lifecycle":"TARGET_PARTIAL","owner":"Conversations and check-ins","kind":"job","states":["queued","running","retry_wait","ready","failed","cancelled","dead_letter"],"authoritative_store":"ops.generation_jobs","deduplication":"durable response_job_id metadata plus deterministic assistant client id","lease":"Required with heartbeat","terminal_result":"Atomically persisted assistant message or stable failure code","evidence":["ADR-006","ADR-007","app/v2/application/conversation_job_runner.py","app/v2/infrastructure/plan_worker_entrypoint.py"],"notes":"Bounded runner, Gemini adapter, and combined plan/conversation worker composition are implemented. Owner/clinical staging approval and live provider verification remain pending."},
    {"id":"job.plan_evaluation","name":"Asynchronous plan evaluation","lifecycle":"TARGET_PLANNED","owner":"Evidence, AI safety and evaluation","kind":"job","states":["queued","running","retry_wait","ready","failed","cancelled","dead_letter"],"authoritative_store":"ops.generation_jobs","deduplication":"plan_id plus evaluation_version","lease":"Required","terminal_result":"Versioned plan evaluation","evidence":["ADR-007","ADR-008"]},
    {"id":"job.account_export","name":"Account export","lifecycle":"TARGET_IMPLEMENTED_UNVERIFIED","owner":"Onboarding, consent and profiles","kind":"job","states":["queued","running","retry_wait","ready","failed","cancelled","dead_letter"],"authoritative_store":"ops.generation_jobs","deduplication":"user plus Idempotency-Key","lease":"Required","terminal_result":"Time-limited private encrypted object reference and manifest checksum; job result has no URL or payload","evidence":["20260808_0009","ADR-007","ADR-013","app/v2/application/account_lifecycle.py","app/v2/infrastructure/account_lifecycle.py","app/v2/infrastructure/plan_worker_entrypoint.py","tests/test_v2_postgres_account_lifecycle.py"],"notes":"The single worker process has a job-type-filtered export lane using the canonical AES-GCM builder and private Supabase adapter. Credential rotation, production private-bucket policy and isolated staging proof remain required."},
    {"id":"job.account_deletion","name":"Complete account deletion","lifecycle":"TARGET_IMPLEMENTED_UNVERIFIED","owner":"Onboarding, consent and profiles","kind":"job","states":["queued","running","retry_wait","ready","failed","cancelled","dead_letter"],"authoritative_store":"ops.generation_jobs","deduplication":"user plus deletion request id","lease":"Required with ordered step ledger","terminal_result":"Deletion verification receipt without health content","evidence":["20260808_0009","ADR-007","ADR-013","app/v2/application/account_lifecycle.py","app/v2/infrastructure/account_lifecycle.py","app/v2/infrastructure/plan_worker_entrypoint.py","tests/test_v2_postgres_account_lifecycle.py"],"notes":"The single worker process has a job-type-filtered deletion lane. It remains fail-closed unless the non-secret API/runtime enablement flag, complete worker credentials and owner/legal approval reference are all configured. The checkpoint eraser recognizes only the pinned public LangGraph layout and user:{uuid}: thread namespace; global checkpoint_migrations is retained. Credential rotation, private-bucket verification, legal retention decision and isolated live proof remain required before activation."},
    {"id":"job.outbox_publish","name":"Outbox publication","lifecycle":"TARGET_PARTIAL","owner":"Media, jobs and operational infrastructure","kind":"job","states":["pending","running","published","failed"],"authoritative_store":"ops.outbox_events","deduplication":"At-least-once delivery; every consumer durably deduplicates on outbox event id","lease":"PostgreSQL FOR UPDATE SKIP LOCKED lease with heartbeat, expiry recovery and bounded attempts","terminal_result":"published_at or redacted failed error_code","evidence":["ADR-007","20260808_0010","tests/test_v2_outbox_worker.py"],"notes":"Deliberately excluded from the combined Render worker: only a deterministic test publisher exists. An approved production event-bus publisher, destination credentials, consumer deduplication proof, and staging delivery verification are required before composition."},
    {"id":"event.plan_ready","name":"plan.ready.v1","lifecycle":"TARGET_PLANNED","owner":"Plans, actions and Daily Review","kind":"domain_event","producer":"Plan publication transaction","payload":"event id, plan id, revision, user id, local date, occurred_at; no health answers","consumers":["evaluation enqueue","telemetry projection"],"evidence":["ADR-004","ADR-007"]},
    {"id":"event.action_event_recorded","name":"action-item.event-recorded.v1","lifecycle":"TARGET_PLANNED","owner":"Plans, actions and Daily Review","kind":"domain_event","producer":"Action-event transaction","payload":"event id, item id, user id, event type, local date, occurred_at","consumers":["streak adjudication","progress projection"],"evidence":["ADR-004","ADR-007"]},
    {"id":"event.daily_review_recorded","name":"daily-review.recorded.v1","lifecycle":"TARGET_PARTIAL","owner":"Plans, actions and Daily Review","kind":"domain_event","producer":"Daily Review transaction","payload":"review id, plan id, user id, local date, occurred_at; no answer text","consumers":["metric reconciliation"],"evidence":["ADR-004","ADR-005","20260808_0011"],"notes":"Streak adjudication and any earned-day grant are committed inline from the normalized review; no outbox event is emitted in this slice."},
    {"id":"event.account_deletion_requested","name":"account.deletion-requested.v1","lifecycle":"TARGET_PARTIAL","owner":"Onboarding, consent and profiles","kind":"domain_event","producer":"DELETE /api/v2/me transaction","payload":"deletion job id and deletion request id; owner relation is erased with the account","consumers":["deletion worker"],"evidence":["20260808_0009","ADR-007","ADR-013"]}
  ]
}
