{
  "schema_version": "1.0.0",
  "catalog": "metrics",
  "snapshot": {
    "as_of": "2026-08-01",
    "baseline": "Proposed v2 metric dictionary; targets are not current claims",
    "approval": "PENDING_OWNER"
  },
  "records": [
    {
      "id": "metric.plan_generation_success",
      "name": "Plan-generation success",
      "lifecycle": "TARGET_PLANNED",
      "owner": "Plans, actions and Daily Review",
      "formula": "COUNT(terminal plan-generation jobs with state=ready) / COUNT(non-cancelled terminal plan-generation jobs)",
      "grain": "Plan-generation job",
      "timezone": "UTC event time; no local-date grouping unless explicitly requested",
      "exclusions": ["state=cancelled", "synthetic traffic unless labeled as a separate series"],
      "source_fields": ["ops.generation_jobs.job_type", "ops.generation_jobs.state", "ops.generation_jobs.terminal_at"],
      "freshness": "5 minutes",
      "consumers": ["generation SLO", "provider incident triage", "release gate"],
      "initial_target": ">= 98% valid plan generation",
      "evidence": ["ADR-007", "ADR-010"]
    },
    {
      "id": "metric.ready_plan_completeness",
      "name": "Ready-plan completeness",
      "lifecycle": "TARGET_PLANNED",
      "owner": "Plans, actions and Daily Review",
      "formula": "COUNT(READY plans satisfying four-action/sixteen-reachable-image invariant) / COUNT(all READY plans)",
      "grain": "Published plan revision",
      "timezone": "Plan immutable timezone/local_date; evaluated at publication and rechecked in UTC",
      "exclusions": ["non-READY revisions"],
      "source_fields": ["app.action_plans.state", "app.action_plan_items.slot", "app.media_assets.storage_key", "app.action_plan_item_variants.variant_type"],
      "freshness": "At publication plus hourly reconciliation",
      "consumers": ["publication gate", "missing-image alert", "release gate"],
      "initial_target": "100%",
      "evidence": ["ADR-004", "ADR-009", "ADR-010"]
    },
    {
      "id": "metric.action_completion",
      "name": "Action completion",
      "lifecycle": "TARGET_IMPLEMENTED_UNVERIFIED",
      "owner": "Progress, streaks, rewards and refreshes",
      "formula": "COUNT(distinct eligible active items whose latest canonical event is completed) / COUNT(eligible active items)",
      "grain": "Eligible action-plan item over the selected reporting period",
      "timezone": "Use stored plan timezone and local_date for daily grouping",
      "exclusions": ["superseded before presentation", "cancelled plan", "duplicate/replayed events"],
      "source_fields": ["app.action_plan_items.id", "app.action_plan_items.status", "app.action_item_events.event_type", "app.action_item_events.decision_local_date", "app.action_item_events.decision_timezone"],
      "freshness": "Near-real-time after committed action event",
      "consumers": ["progress summary", "product analytics"],
      "evidence": ["ADR-004", "ADR-010", "tests/test_v2_engagement.py"],
      "notes": "Implemented in the v2 progress query; PostgreSQL and staging verification remains required."
    },
    {
      "id": "metric.daily_adherence",
      "name": "Daily adherence",
      "lifecycle": "TARGET_IMPLEMENTED_UNVERIFIED",
      "owner": "Progress, streaks, rewards and refreshes",
      "formula": "COUNT(completed active items) / COUNT(items presented for the closed user-local day)",
      "grain": "User and closed local business date",
      "timezone": "Immutable IANA timezone and local_date stored on plan/streak decision",
      "exclusions": ["open/current local day from finalized series", "items replaced before presentation"],
      "source_fields": ["app.action_plans.user_id", "app.action_plans.local_date", "app.action_plans.timezone", "app.action_plan_items.id", "app.action_plan_items.status", "app.action_item_events.event_type", "app.action_item_events.decision_local_date"],
      "freshness": "Finalized after local day close; current day may be provisional and labeled",
      "consumers": ["progress summary", "streak adjudication"],
      "evidence": ["ADR-005", "ADR-010", "tests/test_v2_engagement.py"],
      "notes": "The current day is returned as provisional; closed-day historical reporting is not yet exposed."
    },
    {
      "id": "metric.current_streak",
      "name": "Current streak",
      "lifecycle": "TARGET_IMPLEMENTED_UNVERIFIED",
      "owner": "Progress, streaks, rewards and refreshes",
      "formula": "Number of consecutive closed local dates ending at yesterday whose streak_days adjudication_state is earned or frozen",
      "grain": "User as of a closed local business date",
      "timezone": "Each ledger row stores the immutable IANA timezone and local_date used for adjudication",
      "exclusions": ["current day from finalized value", "rows without qualifying evidence or valid freeze ledger link"],
      "source_fields": ["app.streak_days.user_id", "app.streak_days.local_date", "app.streak_days.timezone", "app.streak_days.adjudication_state", "app.streak_days.evidence_type", "app.streak_days.evidence_id"],
      "freshness": "After local day close or approved repair",
      "consumers": ["home", "progress", "reward eligibility"],
      "evidence": ["ADR-005", "ADR-010", "20260808_0011", "tests/test_v2_engagement.py"],
      "notes": "Closed-day Daily Review adjudication is implemented. Freeze allocation/consumption and historical repair remain pending owner policy."
    },
    {
      "id": "metric.refreshes_used",
      "name": "Refreshes used",
      "lifecycle": "TARGET_IMPLEMENTED_UNVERIFIED",
      "owner": "Plans, actions and Daily Review",
      "formula": "COUNT(successful plan_refreshes for user and local_date)",
      "grain": "User and local business date",
      "timezone": "Plan timezone and local_date",
      "exclusions": ["failed, rejected or replayed replacement requests"],
      "source_fields": ["app.plan_refreshes.user_id", "app.plan_refreshes.local_date", "app.plan_refreshes.accepted_at"],
      "freshness": "Near-real-time after commit",
      "consumers": ["replacement policy", "home"],
      "evidence": ["ADR-004", "ADR-005", "ADR-010", "20260808_0011", "tests/test_v2_postgres_invariants.py"],
      "notes": "Accepted selected-variant replacements are implemented. Provider-backed replacements and refresh-limit policy remain pending."
    },
    {
      "id": "metric.weekly_checkin_completion",
      "name": "Weekly check-in completion",
      "lifecycle": "TARGET_PLANNED",
      "owner": "Conversations and check-ins",
      "formula": "COUNT(completed check-ins) / COUNT(check-ins due under the approved schedule policy)",
      "grain": "User and ISO week",
      "timezone": "Due decision uses approved user timezone policy; ISO year/week stored",
      "exclusions": ["weeks before feature eligibility", "account-deleted periods", "approved schedule exceptions"],
      "source_fields": ["app.weekly_checkins.user_id", "app.weekly_checkins.iso_year", "app.weekly_checkins.iso_week", "app.weekly_checkins.completed_at"],
      "freshness": "Daily",
      "consumers": ["home due indicator", "product analytics"],
      "evidence": ["ADR-006", "ADR-010"]
    },
    {
      "id": "metric.ai_cost_per_ready_plan",
      "name": "AI cost per ready plan",
      "lifecycle": "TARGET_PLANNED",
      "owner": "Evidence, AI safety and evaluation",
      "formula": "SUM(linked ai_invocations.cost_minor) / COUNT(distinct READY plans)",
      "grain": "Ready plan over reporting period, currency and cost-version",
      "timezone": "UTC invocation completion time",
      "exclusions": ["unlinked experiments", "synthetic evaluation unless labeled", "mixed currencies without conversion policy"],
      "source_fields": ["app.ai_invocations.plan_id", "app.ai_invocations.cost_minor", "app.ai_invocations.currency", "app.action_plans.state"],
      "freshness": "Hourly after provider cost reconciliation",
      "consumers": ["cost dashboard", "provider benchmark", "release review"],
      "evidence": ["ADR-008", "ADR-010"]
    },
    {
      "id": "metric.api_availability",
      "name": "Core synchronous API availability",
      "lifecycle": "TARGET_PLANNED",
      "owner": "Platform engineering",
      "formula": "Good authenticated synthetic and real core API requests / eligible core API requests",
      "grain": "Eligible request classified by operation_id and environment",
      "timezone": "UTC",
      "exclusions": ["client 4xx not caused by service", "planned synthetic exclusions documented before window", "AI job completion"],
      "source_fields": ["telemetry.http.operation_id", "telemetry.http.status_class", "telemetry.environment"],
      "freshness": "1 minute",
      "consumers": ["availability SLO", "incident response"],
      "initial_target": ">= 99.9%",
      "evidence": ["ADR-010", "ADR-014"]
    },
    {
      "id": "metric.daily_review_persistence",
      "name": "Daily Review persistence",
      "lifecycle": "TARGET_PLANNED",
      "owner": "Plans, actions and Daily Review",
      "formula": "COUNT(acknowledged review mutations durably readable with matching idempotent result) / COUNT(acknowledged review mutations)",
      "grain": "Acknowledged Daily Review mutation",
      "timezone": "UTC acknowledgement; plan local_date retained as dimension",
      "exclusions": ["client-aborted request before acknowledgement", "synthetic traffic unless separate"],
      "source_fields": ["app.daily_reviews.id", "ops.idempotency_keys.response_status", "telemetry.http.operation_id"],
      "freshness": "5 minutes plus daily reconciliation",
      "consumers": ["review persistence SLO", "data integrity alert"],
      "initial_target": ">= 99.9% and zero duplicate business keys",
      "evidence": ["ADR-004", "ADR-010", "ADR-011"]
    }
  ]
}
