{
  "schema_version": "1.0.0",
  "catalog": "providers",
  "snapshot": {
    "as_of": "2026-08-01",
    "baseline": "Legacy providers observed in source plus proposed v2 ports",
    "approval": "PENDING_OWNER"
  },
  "records": [
    {"id":"provider.firebase_auth","name":"Firebase Authentication","lifecycle":"TARGET_PLANNED","owner":"Identity and access","disposition":"KEEP","port":"IdentityProvider","data":"authentication subject and account status; no application health-data reads","production_gate":"Company-owned project, two administrators, rotated service credentials, revocation tests","evidence":["backend:app/core/firebase.py","mobile:config/firebase.ts","ADR-002"]},
    {"id":"provider.supabase_postgresql","name":"Supabase PostgreSQL 17","lifecycle":"TARGET_PLANNED","owner":"Platform engineering","disposition":"KEEP","port":"ApplicationDatabase","data":"canonical application, operations and runtime schemas","production_gate":"Separate projects, backend-only private schemas, restore test, TLS and pool limits","evidence":["backend:docs/DATABASE_RECOVERY.md","ADR-012"]},
    {"id":"provider.redis","name":"Redis","lifecycle":"TARGET_PLANNED","owner":"Platform engineering","disposition":"KEEP","port":"QueueCacheLock","data":"opaque queue identifiers, expiring cache and locks only","production_gate":"Separate environments, TLS, eviction policy, failover/restart tests","evidence":["backend:app/core/rate_limiter.py","ADR-007"]},
    {"id":"provider.render","name":"Render","lifecycle":"TARGET_PLANNED","owner":"Platform engineering","disposition":"KEEP","port":"DeploymentPlatform","data":"API/worker runtime and redacted logs","production_gate":"Immutable image, separate API/worker, pre-deploy migration, company ownership and two administrators","evidence":["backend:render.yaml","ADR-001","ADR-014"]},
    {"id":"provider.object_storage","name":"Permanent object storage and CDN","lifecycle":"TARGET_PLANNED","owner":"Media, jobs and operational infrastructure","disposition":"REBUILD","port":"ObjectStorage","data":"immutable generated/approved media and time-limited exports","production_gate":"Content hash, private write credentials, reachable-asset check, lifecycle and erasure tests","evidence":["backend:app/services/image_library_service.py","ADR-009"]},
    {"id":"provider.openai","name":"OpenAI model APIs","lifecycle":"TARGET_PLANNED","owner":"Evidence, AI safety and evaluation","disposition":"REBUILD","port":"LanguageModelGateway and optional MediaGenerator","data":"minimum necessary request during processing; raw health prompts not retained in telemetry","production_gate":"Rotated key, DPA/data-setting review, safety/quality/cost benchmark, timeout and fallback test","evidence":["backend:app/services/action_plan_generator.py","ADR-008"]},
    {"id":"provider.groq","name":"Groq model API","lifecycle":"TARGET_PLANNED","owner":"Evidence, AI safety and evaluation","disposition":"REBUILD","port":"LanguageModelGateway fallback","data":"minimum necessary request during processing","production_gate":"Rotated key and same privacy, safety, quality, cost and timeout gates as primary","evidence":["backend:app/services/weekly_checkin_ai.py","ADR-008"]},
    {"id":"provider.google_gemini","name":"Google Gemini model APIs","lifecycle":"TARGET_PLANNED","owner":"Evidence, AI safety and evaluation","disposition":"REBUILD","port":"LanguageModelGateway or MediaGenerator candidate","data":"minimum necessary request during processing","production_gate":"Not selected until staged benchmark and privacy review","evidence":["backend:app/services/root_cause_engine.py","backend:app/services/image_library_service.py","ADR-008"]},
    {"id":"provider.cloudflare_images","name":"Cloudflare Workers AI image generation","lifecycle":"TARGET_PLANNED","owner":"Media, jobs and operational infrastructure","disposition":"REBUILD","port":"MediaGenerator candidate","data":"approved non-identifying image prompt","production_gate":"Not selected until availability, permanence, safety and cost benchmark","evidence":["backend:app/services/image_library_service.py","ADR-009"]},
    {"id":"provider.ncbi_pubmed","name":"NCBI PubMed/PMC","lifecycle":"TARGET_PLANNED","owner":"Evidence, AI safety and evaluation","disposition":"KEEP","port":"ResearchEvidenceProvider","data":"public research identifiers and metadata","production_gate":"Rate limits, source verification, caching and citation reconciliation tests","evidence":["backend:app/services/pubmed_service.py","ADR-008"]},
    {"id":"provider.pinecone","name":"Pinecone","lifecycle":"AS_IS","owner":"Legacy archive custodian","disposition":"REBUILD","port":"Legacy vector retrieval","data":"legacy evidence embeddings/metadata","production_gate":"No automatic v2 approval; decide after data inventory, deletion behavior and benchmark","evidence":["backend:app/services/rag_service.py","backend:app/core/config.py"]},
    {"id":"provider.firecrawl","name":"Firecrawl","lifecycle":"AS_IS","owner":"Legacy archive custodian","disposition":"REBUILD","port":"Legacy web evidence retrieval","data":"public-page requests and retrieved content","production_gate":"No automatic v2 approval; authoritative-source allowlist and safety review required","evidence":["backend:app/core/config.py","backend:app/services/rag_service.py"]}
  ]
}
