{
  "schema_version": "1.0.0",
  "catalog": "prompts_models",
  "snapshot": {
    "as_of": "2026-08-01",
    "baseline": "Proposed source-controlled prompt/model registry; no model is production-approved here",
    "approval": "PENDING_OWNER"
  },
  "records": [
    {"id":"prompt.plan_generation.v2_0_0","name":"Structured daily plan generation","lifecycle":"TARGET_PLANNED","owner":"Evidence, AI safety and evaluation","task":"plan_generation","version":"2.0.0-proposed","output_schema":"ActionPlanCandidateV2","model_policy":"Primary/fallback selected only after staging benchmark","safety_policy":"health-content-v2-proposed","retention":"Invocation metadata only; no long-term raw health prompt","evaluation":"structure, evidence, citation, personalization and clinical-safety suite","evidence":["ADR-008"]},
    {"id":"prompt.citation_validation.v2_0_0","name":"Citation and claim validation","lifecycle":"TARGET_PLANNED","owner":"Evidence, AI safety and evaluation","task":"citation_validation","version":"2.0.0-proposed","output_schema":"CitationValidationV2","model_policy":"Deterministic checks first; model assistance cannot override missing source","safety_policy":"evidence-v2-proposed","retention":"No raw health prompt","evaluation":"source identity, claim support and unverifiable-claim fail-closed cases","evidence":["ADR-008"]},
    {"id":"prompt.clinical_safety.v2_0_0","name":"Clinical-safety classification","lifecycle":"TARGET_PLANNED","owner":"Evidence, AI safety and evaluation","task":"clinical_safety_validation","version":"2.0.0-proposed","output_schema":"SafetyDecisionV2","model_policy":"Gateway-selected classifier with deterministic red-flag rules","safety_policy":"health-content-v2-proposed","retention":"Decision/reason codes only; no raw health prompt","evaluation":"red flags, contraindication, diagnostic-claim and escalation fixtures","evidence":["ADR-008","ADR-013"]},
    {"id":"prompt.media_generation.v2_0_0","name":"Non-identifying plan media generation","lifecycle":"TARGET_PLANNED","owner":"Media, jobs and operational infrastructure","task":"media_generation","version":"2.0.0-proposed","output_schema":"Binary image plus safety metadata","model_policy":"Approved primary/fallback or permanent category fallback","safety_policy":"media-v2-proposed","retention":"Versioned prompt template and asset hash; no health answers or identifiers","evaluation":"reachability, dimensions, category fit, duplicate hash and safety scan","evidence":["ADR-009"]},
    {"id":"prompt.conversation_response.v1","name":"Typed conversation response","lifecycle":"TARGET_PARTIAL","owner":"Conversations and check-ins","task":"conversation_response","version":"conversation.v1","output_schema":"ConversationAssistantMessageV2","model_policy":"Provider-neutral port; real provider composition pending","safety_policy":"deterministic-conversation-safety.v1; owner/clinical staging approval pending","retention":"Canonical user/assistant messages in conversation tables; invocation telemetry records HMAC hashes and metadata only","evaluation":"general, care_plan, symptom_checkin, support, weekly_checkin contracts plus deterministic safety fixtures","evidence":["ADR-006","app/v2/domain/conversation_prompts.py","app/v2/application/conversation_response.py"]},
    {"id":"prompt.conversation_summary.v2_0_0","name":"Versioned conversation summary","lifecycle":"TARGET_PLANNED","owner":"Conversations and check-ins","task":"conversation_summary","version":"2.0.0-proposed","output_schema":"ConversationSummaryV2","model_policy":"Low-cost approved model after benchmark","safety_policy":"health-conversation-v2-proposed","retention":"Summary is health data and follows conversation erasure/retention","evaluation":"coverage boundary, factuality and deletion propagation","evidence":["ADR-006","ADR-013"]},
    {"id":"prompt.weekly_checkin.v2_0_0","name":"Weekly check-in guidance","lifecycle":"TARGET_PLANNED","owner":"Conversations and check-ins","task":"weekly_checkin_response","version":"2.0.0-proposed","output_schema":"WeeklyCheckinAssistantMessageV2","model_policy":"Gateway-selected model; questions come from versioned definitions","safety_policy":"health-conversation-v2-proposed","retention":"Canonical messages/responses only; telemetry excludes contents","evaluation":"definition adherence, schedule behavior, safety and completion fixtures","evidence":["ADR-006","ADR-008"]},
    {"id":"prompt.plan_evaluation.v2_0_0","name":"Plan quality and safety evaluation","lifecycle":"TARGET_PLANNED","owner":"Evidence, AI safety and evaluation","task":"plan_evaluation","version":"2.0.0-proposed","output_schema":"PlanEvaluationV2","model_policy":"Evaluator model isolated from generator selection","safety_policy":"evaluation-v2-proposed","retention":"Structured scores/reason codes; raw response expires under approved policy","evaluation":"golden fixtures, inter-rater consistency and cost/latency limits","evidence":["ADR-008"]},
    {"id":"prompt.free_text_structuring.v2_0_0","name":"Health free-text structuring","lifecycle":"TARGET_PLANNED","owner":"Onboarding, consent and profiles","task":"free_text_structuring","version":"2.0.0-proposed","output_schema":"ValidatedAssessmentFieldV2","model_policy":"Optional; deterministic validation remains authoritative","safety_policy":"health-input-v2-proposed","retention":"Structured assessment field only; invocation telemetry excludes input","evaluation":"schema validity, no invented facts, unsafe-input and timeout fixtures","evidence":["ADR-003","ADR-008"]}
  ]
}
